"301","201","Sit porro architecto adipisci ut numquam quae voluptatem perferendis. Accusantium illum cumque in nemo odio unde animi asperiores. Deleniti reprehenderit magnam aut amet.","201","2012-08-06 01:31:07","2012-09-08 15:07:04",
"302","202","Eum velit est sed quo itaque sed quisquam. Dolore quos a nulla.","202","2018-12-20 15:49:38","2020-08-30 21:49:28",
"303","204","Placeat et nihil aliquid praesentium quo. Quasi inventore architecto necessitatibus ipsam. Officia mollitia quam mollitia facilis delectus est exercitationem sed.","204","2014-12-07 19:15:38","2017-12-27 08:29:26",
"304","206","Odit vero eveniet consequatur. Fuga inventore ratione at expedita rerum. Quis itaque qui magnam ratione. Et et earum non delectus voluptatum dolore optio.","206","2012-07-14 16:29:02","2015-04-22 15:04:21",
"305","207","Numquam necessitatibus eveniet magnam voluptatibus quibusdam qui. Explicabo nam rerum deserunt sequi optio consequatur. Dolore doloremque reprehenderit non laudantium quasi et iure.","207","2011-04-16 13:24:41","2015-12-20 13:20:53",
"306","208","Quis autem mollitia aut id. Rerum ab exercitationem veniam repellat. Accusantium modi facilis impedit aut.","208","2017-04-28 22:58:09","2018-12-12 16:04:06",
"307","209","Hic modi maiores illum blanditiis explicabo qui illum. Deleniti molestiae aut facere amet expedita. Voluptatem asperiores magni doloribus sed voluptate eum eveniet.","209","2017-07-08 22:44:13","2018-10-20 12:33:52",
"308","210","Perspiciatis exercitationem hic doloremque sunt fugiat enim officiis. Voluptatum et consequatur omnis itaque. Ut tenetur qui quis molestiae sit. Sit qui minus praesentium.","210","2013-05-13 10:39:08","2014-08-05 14:25:20",
"309","213","Vero mollitia recusandae dolores ut assumenda. Ex fugiat iusto deserunt magnam. Ut dignissimos quaerat voluptate cum mollitia inventore rerum. Sapiente maiores quis id officia neque et.","213","2015-03-31 18:25:35","2016-03-20 16:26:33",
"310","215","Quidem modi ea ut est velit. Voluptates ea saepe nobis corporis iste. Ad quaerat ad veniam voluptatem similique unde unde. Molestiae molestiae qui et minus facilis voluptatibus nemo.","215","2015-09-24 06:33:55","2016-02-20 23:29:45",
"311","221","Sed unde similique eos ut pariatur. Nobis nihil cupiditate aut dolor ipsam et iusto. Tenetur dolor esse veniam distinctio. Iste quisquam ut facere est.","221","2011-09-28 15:49:32","2020-02-24 06:55:47",
"312","224","Reiciendis ipsam est minima quod. Ipsam dolore et aut at dignissimos. Amet quisquam officiis quasi consequuntur est excepturi minima.","224","2011-08-09 08:51:12","2014-12-04 11:22:12",
"313","227","In expedita dolores autem nihil dolorem omnis consectetur. Nihil est impedit commodi ullam eos consequatur natus ab. Aspernatur ab corporis non vel sint rerum.","227","2017-02-02 00:14:05","2018-07-27 12:57:00",
"314","228","Cupiditate et exercitationem neque qui accusamus sit tempore praesentium. Et expedita vel consequatur est dolorum sint nostrum rem. Sit harum architecto labore qui quam sed aliquam.","228","2017-09-22 22:18:31","2019-09-20 11:16:30",
"315","229","Eos nihil modi sint perferendis et aut. Sapiente voluptas omnis modi. Nesciunt qui quia magnam eveniet laboriosam. Placeat temporibus qui id qui distinctio qui.","229","2015-08-02 20:06:37","2018-01-17 02:06:00",
"316","230","Necessitatibus quam voluptatem numquam voluptas quibusdam. Voluptas praesentium ducimus animi est officia nesciunt laboriosam aut. Eos eaque cum velit ipsa.","230","2012-09-12 19:14:19","2017-10-23 14:58:39",
"317","231","Ipsam eos totam sit ut. Omnis expedita aut ducimus non eum cum aspernatur. Iusto explicabo mollitia rerum in. Magnam expedita et nesciunt eum ut autem.","231","2011-08-23 10:00:08","2018-05-01 12:32:10",
"318","233","Nihil assumenda tempora aliquam maxime. Expedita nemo voluptas est veniam sequi consequuntur. Non accusantium voluptatibus sed voluptatem ullam laudantium.","233","2017-08-19 18:56:26","2017-12-08 15:30:15",
"319","235","Cum est rerum voluptate sed. Maxime cupiditate nisi in incidunt ipsam voluptas qui. Ratione ducimus natus consequatur eligendi.","235","2017-01-18 22:29:32","2020-09-12 04:11:33",
"320","236","Et ullam et sit quis ut sint rem. Sint pariatur dolores veniam eius consequuntur natus eaque occaecati. Dolores quia voluptatem suscipit facere numquam repellat quo veritatis.","236","2015-01-08 11:49:09","2018-06-30 09:19:48",
"321","239","Quam eum sit at. Labore quaerat ea quaerat velit consequatur. Qui rerum consequatur nostrum sed. Aut fuga voluptatum quia totam.","239","2013-11-26 17:19:41","2015-05-27 09:12:33",
"322","241","Doloremque dignissimos facere odit officiis explicabo. Eius at tempore odit consectetur quia animi laudantium. Impedit quia consequatur aut autem.","241","2013-04-19 07:22:15","2018-02-02 23:25:32",
"323","242","Eos exercitationem earum optio ut velit sequi. Adipisci omnis ut rerum quibusdam necessitatibus quasi sapiente aliquid.","242","2011-08-05 00:09:32","2016-08-01 15:05:31",
"324","245","Corporis et animi nam. Eum reiciendis consequuntur omnis qui. Voluptatem eveniet est doloremque praesentium asperiores voluptatibus accusamus. Enim corporis tenetur ipsum totam consequuntur.","245","2017-02-22 11:26:30","2020-05-17 23:11:51",
"325","246","Culpa magnam omnis sed reiciendis tempore est. Ullam pariatur et consequatur. Unde autem voluptate consequatur modi ut sunt. Ut quidem rerum nesciunt natus.","246","2012-11-17 23:37:09","2020-03-11 19:25:20",
"326","247","Ut unde dolorem quia veritatis. Ex quia eum sed aut expedita atque repellendus. Vel culpa rem amet itaque itaque. Asperiores itaque magnam debitis suscipit tenetur rem.","247","2012-01-01 05:06:22","2014-08-12 19:30:33",
"327","248","Non ut est molestias perferendis doloribus autem autem. Quia architecto rerum quo unde quis ducimus. Ut cum harum rem cumque.","248","2013-08-01 10:57:50","2016-01-21 01:33:56",
"328","249","Vero nam rem perferendis doloremque. Neque quia aliquid necessitatibus et. Maxime molestias sit natus minima et.
Et et id natus quo. Similique doloribus nesciunt optio asperiores suscipit.","249","2017-08-19 00:30:37","2018-01-15 07:25:15",
"329","253","Architecto aut ex qui. Molestiae voluptatem sed quaerat quisquam corporis ut neque. Aut vero quasi autem nulla natus et nisi.","253","2013-08-31 20:46:57","2014-07-23 18:35:51",
"330","255","Voluptatem qui voluptates sunt nemo. Ea alias et ut inventore. Fugit saepe quam pariatur assumenda eligendi inventore. Et nemo earum ipsa.","255","2012-06-04 17:04:30","2020-10-01 09:09:09",
"331","256","Quia eum sapiente est quam ut labore. Fuga laborum rerum suscipit ut temporibus. Ullam aut voluptatem et impedit temporibus. Dolorem eaque voluptatem ut aut ullam ea.","256","2015-06-26 01:16:47","2017-03-14 12:17:22",
"332","259","In neque ut quae officiis nam pariatur excepturi. At nam voluptate ad aut qui. Explicabo officiis atque dicta voluptas beatae. Amet sit nemo ex vel nesciunt quibusdam maiores.","259","2015-12-25 02:53:53","2017-03-12 15:17:57",
"333","262","Distinctio explicabo quos voluptates dolor. Rerum ducimus ea magnam illum ratione ad velit. Blanditiis temporibus ipsum neque enim velit est. Neque rerum sit aliquam eius.","262","2012-11-23 12:10:59","2015-04-06 09:13:40",
"334","270","Rerum asperiores eum temporibus enim quia exercitationem hic. Vel ut quisquam eum minima aut. Tenetur et molestiae autem est sapiente.","270","2018-04-19 15:30:13","2020-04-28 21:31:36",
"335","274","Necessitatibus voluptas veritatis autem temporibus sed est aliquid. Sit quaerat consequuntur dolorem. Accusamus sit provident enim et laborum quos alias.","274","2015-05-07 11:48:55","2017-02-27 03:26:18",
"336","275","Non qui culpa nobis magni autem. Ab fuga unde voluptatem non id nesciunt esse. Quia dolorem commodi iure eveniet quibusdam. Voluptas qui aliquid voluptatem voluptatem deserunt laborum ut molestiae.","275","2011-09-14 13:12:21","2016-01-29 05:49:32",
"337","277","Qui delectus eos quia tenetur commodi. Veritatis et quae dolores nihil distinctio. Sequi qui omnis qui inventore quis. Cum et temporibus voluptate cumque.","277","2012-08-07 09:24:35","2017-06-25 10:45:32",
"338","281","Sit aut maiores et commodi est pariatur quia. Delectus et quaerat adipisci nihil nulla architecto. Eveniet non ut dignissimos voluptatem.","281","2013-05-13 05:25:18","2021-01-07 18:35:50",
"339","284","Sit ab temporibus non omnis tenetur commodi. Molestias repellendus quia et ex ea. Perferendis ut deleniti deleniti est animi eligendi non. Qui aperiam cumque magnam.","284","2016-01-09 12:27:53","2017-05-08 20:27:22",
"340","288","Harum voluptate quasi officia exercitationem ab. Quos nesciunt quos reiciendis quia fugiat reiciendis. Dolorem perspiciatis et cum. Autem aliquid cum est incidunt dolor.","288","2013-11-02 05:18:21","2016-08-11 01:54:49",
"341","289","Accusamus animi et quis qui magnam est consequatur. Non modi ea voluptates sequi autem. Sit voluptas ut ea praesentium iste quo.","289","2011-04-06 01:56:34","2017-07-01 04:23:21",
"342","290","Reprehenderit nemo a quis distinctio dolorem odit et. Enim dolorem cum ut. Qui ad consequatur omnis autem. Mollitia totam recusandae inventore qui.","290","2014-11-21 09:55:47","2015-07-22 02:53:59",
"343","291","Iusto velit quo voluptas est ducimus quibusdam voluptatem. Magni est et molestiae. Atque aliquid consequatur et quaerat amet dolorum. Vel minus blanditiis temporibus labore totam officia deleniti.","291","2017-08-11 01:11:42","2020-01-23 08:14:47",
"344","292","Ea sint delectus ut dolore ratione. Vero voluptatem a ipsum saepe perferendis.","292","2017-07-02 15:52:54","2019-03-31 23:45:47",
"345","294","Sed rem voluptates est rerum. Rem rem veritatis fugiat ut porro. Tempore aut autem cumque saepe eius.","294","2014-01-04 18:17:26","2017-03-24 05:33:05",
"346","298","Voluptatibus voluptatum fugit consequatur vitae porro vero. Qui illum consequatur quia itaque nobis. Laudantium officia est aut repudiandae. Quo debitis vero blanditiis est.","298","2015-04-08 04:39:16","2018-04-11 17:21:25",
"347","299","Qui ut nihil dolorem ut accusamus dignissimos. Praesentium cum optio numquam dolorem. Nemo vero impedit vel sint.","299","2012-05-15 20:23:56","2018-03-24 16:38:50",
"348","301","Necessitatibus laborum eligendi alias ut. Beatae ab assumenda qui unde. Quisquam et qui qui et. Labore illo tempora est ab nihil voluptates.","301","2011-10-08 18:09:41","2014-10-11 06:13:08",
"349","304","Nisi quo quas unde exercitationem. Illo quidem voluptates quia sed deserunt. Blanditiis hic odio nihil explicabo et quo. Illo eveniet nemo voluptates aperiam ea vero dignissimos.","304","2013-04-29 04:34:37","2014-08-25 13:54:35",
"350","307","Est porro asperiores et officiis. Nihil quidem eius quo exercitationem fugit ut. Laborum quasi distinctio voluptatem eos iure.","307","2014-05-24 21:04:58","2019-07-19 09:43:47",
"351","314","Suscipit libero quia totam accusamus. Pariatur dolorem accusantium reiciendis cum nemo totam laudantium. Labore voluptatem cum qui quaerat officiis mollitia.","314","2014-06-15 06:12:45","2014-12-17 10:02:11",
"352","317","Recusandae suscipit perspiciatis sint atque et. Velit deleniti consequatur consequatur adipisci qui corporis et aut. Inventore corrupti dolorem qui nobis veritatis.","317","2017-12-30 23:44:25","2019-06-28 11:19:25",
"353","319","Beatae ut sit ut excepturi placeat exercitationem dignissimos. Ducimus perferendis quod voluptatibus qui voluptatibus. Ut et commodi quia eaque.","319","2014-02-09 13:38:50","2015-04-07 04:32:09",
"354","322","Delectus aut culpa dolorem fugit expedita. Porro omnis molestiae qui molestiae. Id quaerat sunt facilis praesentium tempora id perferendis ipsum.","322","2015-10-02 02:48:58","2017-11-10 12:37:11",
"355","323","Voluptatem dolore voluptatum aut tenetur neque quos ut. Laudantium consequuntur quibusdam alias. Et blanditiis cumque ex error. Voluptatem dolorem impedit sint voluptas saepe et.","323","2016-11-16 21:29:49","2016-12-28 12:38:47",
"356","324","Natus illo ad qui. Dolor magni possimus repellat pariatur iusto id. Quia repellat rerum autem quae voluptatum dolorem. Et error et adipisci aut reprehenderit voluptas.","324","2014-12-07 09:57:43","2019-09-11 19:03:30",
"357","327","Hic et dolores alias iste. Explicabo voluptas culpa voluptas occaecati. Ad a vel quia porro in.","327","2011-08-03 04:02:45","2012-05-11 04:09:58",
"358","330","Quia placeat maiores velit fugiat sed. Quia ad non ratione facere maiores. Iusto dolor facilis quae velit odit.","330","2015-09-27 01:04:19","2015-12-15 21:36:14",
"359","334","Dolores dignissimos est tempora velit aliquid dolores ducimus. Ipsa accusamus nesciunt non doloremque quasi veritatis. Quasi aliquid iste qui sunt quidem. Vitae repellendus autem magnam.","334","2015-04-28 14:53:22","2015-08-01 13:56:26",
"360","335","Id ut sint quidem molestiae exercitationem tenetur officia expedita. Accusantium id aut voluptates dolor fugit temporibus. Temporibus molestiae quibusdam est non corrupti est.","335","2017-08-07 16:16:51","2019-12-20 01:36:22",
"361","339","Sint in veritatis ea occaecati. Alias ullam veniam totam culpa voluptas.","339","2016-07-30 08:14:03","2017-01-01 12:40:49",
"362","340","Soluta ratione a vitae soluta recusandae optio quisquam. Saepe vero labore quos totam vel. Est dolorem sed dolorum adipisci molestiae.","340","2019-06-09 14:44:21","2019-09-06 19:12:40",
"363","342","Sit blanditiis officiis eius accusantium aut rerum rerum earum. Vel tempora esse aperiam molestias nisi quia error. Molestias ullam minima consectetur sapiente ut.","342","2011-01-27 04:34:28","2012-11-20 20:59:05",
"364","343","Corrupti praesentium placeat eos accusamus. Quis perferendis esse minus ut neque. Sint est voluptas est id nihil. Explicabo consequuntur id eos et impedit dolor.","343","2012-11-05 11:50:13","2013-04-24 05:20:18",
"365","344","Placeat dignissimos et distinctio fugit nostrum quaerat. Quam voluptates porro fugit natus explicabo sunt.","344","2012-06-22 03:25:37","2017-07-05 12:57:11",
"366","201","Quia et ipsum facere aspernatur. Et qui voluptatem laudantium dolorem. Amet eius eligendi unde deserunt occaecati rerum autem. Qui maxime suscipit harum possimus pariatur quod maiores.","350","2013-06-03 01:18:40","2013-12-18 06:24:42",
"367","204","Veritatis odio eos voluptates molestiae. Qui perferendis in sed labore unde placeat. Velit rerum tempora iste provident consectetur eum. Temporibus exercitationem et aperiam nobis.","353","2013-08-18 12:52:41","2013-10-23 17:22:00",
"368","209","Praesentium quisquam fuga accusantium possimus. Quia earum dicta velit fugiat non vitae facilis. Est ullam consequatur qui temporibus ut aut perferendis.","358","2014-11-30 11:00:52","2020-07-11 02:18:53",
"369","210","Neque libero ullam eum aut iure. Pariatur sunt perspiciatis impedit saepe eos molestiae. Doloribus quo velit et autem. Inventore quia ab commodi repellat itaque labore et.","359","2012-12-10 12:12:19","2018-03-13 23:23:51",
"370","211","Necessitatibus rem et eligendi itaque perferendis saepe. Repellat nobis ab corporis beatae. Quia voluptas veritatis ipsum.","360","2011-05-28 12:31:23","2017-06-07 10:35:17",
"371","213","Velit saepe quod eligendi excepturi et iusto. Autem illum molestiae quis amet rem molestiae accusamus aut. Laborum eum blanditiis nihil aut aperiam non.","362","2011-05-08 12:41:48","2013-01-29 02:36:56",
"372","215","Quaerat omnis enim facilis est. Incidunt voluptate neque quis accusantium velit. Et in consequuntur velit. Est ipsa unde ex a unde.","364","2013-04-23 17:30:35","2020-03-25 12:40:00",
"373","216","Consequatur rerum qui enim omnis. Consequuntur distinctio cupiditate eos sed id. Qui eos ullam odio ipsum incidunt.","365","2017-05-10 00:10:56","2018-09-12 01:36:43",
"374","219","Asperiores voluptate a modi. Impedit tenetur numquam incidunt autem accusamus. Voluptatibus voluptas magni est velit minima voluptates adipisci voluptas.","368","2011-10-03 12:34:33","2013-05-11 14:45:27",
"375","222","Voluptas aspernatur modi distinctio exercitationem dolore sapiente. Unde accusantium officia praesentium maiores. Tempore autem quae ipsum ab. Qui et nesciunt blanditiis iste.","371","2013-03-07 20:15:52","2020-06-11 07:43:56",
"376","225","Quisquam consequatur nihil et dolor velit. Voluptates quia quis repudiandae sunt vero dicta. Velit aliquid omnis eaque dolores. Est natus fugiat velit sed ut.","374","2015-05-18 04:18:36","2015-10-28 04:00:31",
"377","226","Mollitia occaecati fugit ipsam voluptatem sit est. Eum est quam at animi consectetur consequuntur soluta. Exercitationem et animi ex optio quibusdam.","375","2012-10-08 08:34:27","2016-06-16 20:43:20",
"378","229","Delectus et eveniet ipsa. Quos pariatur ut doloremque est. Porro quia rerum repellat voluptates. Eos aliquam veritatis ratione ea.","378","2015-09-11 18:57:10","2018-01-24 15:57:00",
"379","230","Ut quod velit in cupiditate alias. Optio omnis vel qui. Nobis fugit est dolor voluptates sint amet et officia.","379","2016-08-07 09:10:46","2018-07-22 22:23:35",
"380","231","Ullam laborum voluptate architecto optio ullam et mollitia nam. Sequi velit commodi nihil eum ad quas. Vel voluptatibus animi aut ut quis aut ducimus. Laudantium ab eligendi eius ut blanditiis.","380","2013-10-27 11:24:43","2015-04-23 00:41:59",
"381","232","Velit voluptatem inventore minus. Dolorum voluptas at fuga sit delectus doloribus a. Omnis id assumenda ullam excepturi. Quos sint animi voluptates et iusto qui non.","381","2013-03-04 10:59:14","2019-04-21 02:14:40",
"382","236","Occaecati et sed ut id eum ipsa dignissimos. Pariatur esse et quis nisi hic. Et eius qui fugiat eum ea unde.","385","2015-06-17 10:58:13","2015-11-03 03:07:46",
"383","237","Nulla incidunt dolores quibusdam quis quibusdam. Qui iste voluptatibus quia dolore aperiam molestiae. Ducimus itaque aut est inventore ratione.","386","2014-06-02 20:46:12","2017-11-01 12:26:06",
"384","241","Enim consequuntur ea ratione doloremque fugiat voluptatem. Laboriosam ut culpa provident asperiores modi laborum dolore. Nostrum et facere dolor excepturi et.","390","2011-09-14 15:39:58","2017-02-21 06:42:32",
"385","242","Dolores aut provident occaecati. Esse voluptate iusto libero occaecati dolores. Deserunt corrupti qui explicabo nisi ipsum sit consequatur impedit.","391","2012-02-05 19:11:13","2018-08-09 07:52:30",
"386","243","Consectetur aspernatur ut est voluptatem. Dolorum minus pariatur beatae earum. Distinctio repellendus inventore id neque aut facilis. Et quae distinctio beatae fugiat.","392","2013-09-13 22:48:36","2019-06-17 13:39:38",
"387","244","Et provident molestias at. Ut aut est dolor corporis culpa laborum fugit. Consequatur beatae sed minima aspernatur quaerat deleniti possimus. Id rerum ad ipsam reprehenderit consequatur.","393","2017-10-30 19:00:18","2018-07-29 09:26:15",
"388","245","Ut quo soluta ut est. Molestiae iusto ut dolorem. Voluptatem similique veritatis omnis officia voluptatem animi tempore et.","394","2018-08-21 08:00:09","2019-01-08 12:42:51",
"389","246","Quia nobis quas debitis eveniet. Magnam vero consequuntur dolorem ea. Et aut sint quia quaerat accusamus nostrum. Expedita dolorum sed quidem incidunt. Ipsum at neque deserunt soluta.","395","2013-08-27 02:39:49","2020-05-31 12:49:59",
"390","247","Dolores consectetur rem esse qui deleniti eos rerum. Ex odio voluptas voluptatum blanditiis doloremque non. Est dolore eum qui facere quam.","396","2013-02-15 13:31:08","2017-07-28 23:55:46",
"391","248","Incidunt sapiente ut enim dolorum quidem et. Odit aut accusamus et nam dolores aut. Quas eos vel eos. Ab et blanditiis repellendus voluptatem. Veritatis magni consequuntur esse eligendi.","397","2017-05-17 16:01:06","2019-06-14 16:52:59",
"392","249","Rerum quod quisquam officia cupiditate accusamus. Hic qui recusandae veniam eum qui quo explicabo. Eius voluptatum quod dicta magnam non nemo. Sed quia sit dolores ea inventore.","398","2012-12-07 08:27:21","2016-06-02 11:43:24",
"393","250","Aspernatur et quisquam voluptatem praesentium eveniet aliquam rem. Laudantium qui pariatur dolor voluptates qui eos.","399","2011-08-22 02:25:00","2017-05-14 03:21:41",
"394","252","Fugiat odit repudiandae placeat corporis recusandae aliquam. Aut sunt sint sequi hic. In necessitatibus repudiandae corporis.","401","2014-02-02 19:04:43","2014-02-24 14:41:15",
"395","253","Quis aliquam illum sapiente aut. Ducimus et eos qui cupiditate quia sed ut. Veritatis ex ducimus et sit eos consequatur. Fuga qui doloribus eligendi aliquam.","402","2017-03-06 04:20:56","2019-12-18 01:33:52",
"396","254","Perferendis tempora eius ipsa vel odio doloremque sed. Neque consequatur laborum quaerat qui.","403","2012-05-09 06:42:25","2013-06-02 14:45:08",
"397","255","Sunt itaque exercitationem eos velit rerum laboriosam et. Iste omnis exercitationem eaque quidem sed quae consequatur. Et est rerum pariatur cumque cum aperiam. Dolor officiis molestiae rem magni.","404","2017-06-28 15:55:31","2018-08-18 09:42:20",
"398","256","Quia aut explicabo quia unde tempore quae. Asperiores rerum alias sint velit. Nisi qui corporis nihil nobis officia magni. Ea est dolorum ipsa ipsa repellendus sit voluptatem.","405","2018-12-29 02:26:49","2019-12-04 11:29:27",
"399","257","Voluptatum earum expedita deserunt vitae quod. Perspiciatis incidunt omnis ut molestiae ducimus rerum enim. Inventore fuga repellat doloribus vitae eum. Cupiditate velit tempore in quis a.","406","2011-11-10 22:35:26","2016-10-27 10:20:25",
"400","258","Recusandae non ut voluptatem perspiciatis sunt voluptatem vero tenetur. Explicabo eligendi corporis quo aut repellendus est. Quas nesciunt blanditiis quis et dolores alias.","407","2011-10-14 16:59:03","2013-04-15 08:15:49",
"401","261","Omnis debitis est et tempora. Et quia rem quasi enim. Qui quia quia qui qui esse magnam cupiditate. Ea et eos expedita exercitationem quia ad et.","410","2014-03-25 23:03:14","2019-01-15 19:00:42",
"402","262","Ipsum quasi est laboriosam fugiat quo officia earum repellendus. Officia fugit dolore omnis possimus accusamus odio fugiat. Iste qui et est. Nihil veniam non quae fugit.","411","2017-01-02 01:11:45","2017-05-23 01:36:46",
"403","266","Iste autem eum corporis sed repudiandae natus et. At neque reprehenderit iure eum itaque. Reiciendis nulla optio sint cum velit.","415","2011-04-17 09:04:00","2015-07-06 04:07:58",
"404","268","Doloremque quisquam reprehenderit ab beatae eius laudantium. Et veniam ea eos reprehenderit aut tempore dolor. Aspernatur aliquam impedit aut architecto minima.","417","2013-06-10 11:58:57","2020-03-30 13:56:12",
"405","270","Quisquam sit et in et aut voluptates. Quidem saepe rem quo quia molestiae eum. Quos id aut laudantium enim quos distinctio. Temporibus culpa magnam et nisi.","419","2011-05-24 19:38:03","2013-09-20 14:09:18",
"406","273","Aperiam ut eius magnam sed. Velit voluptas fugiat laboriosam. Quasi quam eum quibusdam accusamus.","422","2017-07-04 09:28:11","2019-09-10 10:40:38",
"407","274","A tempora vitae perferendis minima. Ipsa quis ut temporibus expedita. Vel repellendus error quasi aut. Laboriosam iste ducimus ullam rem et explicabo. Est at hic explicabo temporibus.","423","2013-07-23 09:27:02","2020-08-09 13:56:06",
"408","275","Consequuntur enim quibusdam id similique laborum. Enim odio quo et et nisi dicta. Sapiente omnis aliquid odio autem. Eaque officia laborum in facere. Dolorem quis alias natus sed fuga atque.","424","2015-03-11 13:28:09","2015-05-16 01:58:49",
"409","278","Blanditiis veritatis mollitia facere et aut quia illo. Vero nam sit id qui quidem. Ut temporibus voluptates dolor est praesentium sint. Et neque est culpa.","427","2013-07-22 04:17:14","2015-05-13 22:20:40",
"410","281","Officia qui quibusdam perspiciatis excepturi est architecto cupiditate. In sed omnis saepe aliquid nam aliquam velit. Id labore laboriosam voluptatem ex et ea. Veritatis eos repellat deserunt qui ut.","430","2014-07-16 20:32:39","2018-09-19 12:24:47",
"411","282","Sequi voluptas cupiditate harum non. Nisi ut quam distinctio quo. Nam ipsa possimus nihil aut.
Sit vitae pariatur ab et non quo. Minima qui officia deleniti est omnis.","431","2014-04-23 11:27:53","2014-11-25 02:32:46",
"412","283","Blanditiis architecto iste aut tempore fugit itaque sed. Delectus cupiditate reiciendis praesentium rerum labore. Facere ea iste enim aut architecto. Aut quisquam corrupti aut id qui eos.","432","2011-11-09 19:13:34","2014-06-29 06:40:34",
"413","284","Doloribus delectus nostrum repellat officia. Est nostrum ea dolorum dolor unde minima quia. Quibusdam molestiae dolore suscipit rem quis.","433","2015-10-11 19:46:09","2019-06-15 13:43:52",
"414","285","Labore fugiat tempore illum voluptates repellat. Distinctio perspiciatis doloremque qui dolor laborum qui quod. Debitis qui ut numquam vel ab omnis fugit fuga.","434","2015-08-05 12:09:40","2021-01-06 07:38:32",
"415","288","Sequi odit est est. Voluptatem cumque saepe consequatur ut est. Est iure ut nesciunt veniam hic sapiente.","437","2017-09-27 19:29:53","2021-01-06 13:22:36",
"416","289","Culpa quis adipisci incidunt omnis officiis. Hic ipsam totam quibusdam consequuntur rerum nesciunt aperiam. Qui alias dolor fugiat sint dolor quia omnis. Aut in ut illum ad eum qui.","438","2012-06-15 02:51:31","2020-09-22 02:12:43",
"417","296","Aut minima ut qui consectetur culpa distinctio eius et. Alias inventore pariatur dolores quae velit pariatur commodi et. Hic quam aut odio omnis veniam.","445","2012-05-19 18:40:33","2015-06-17 10:42:01",
"418","297","Et ullam quibusdam omnis at ducimus in beatae reprehenderit. Doloremque labore repudiandae quam dolorum est dolorem. Eos ex alias quas. Inventore quaerat est nobis.","446","2011-02-22 21:02:34","2018-01-29 16:53:33",
"419","301","Ratione rerum velit fuga id sed at. Sunt quo consequatur excepturi vel est molestias rerum. Sit officia dolor qui id numquam. Accusamus cum animi illo id.","450","2012-02-12 17:08:55","2013-11-24 11:11:21",
