"420","302","Sequi optio consequuntur quia accusantium optio ab. Consequatur delectus libero iure in eos est. Quas atque tenetur officiis eum voluptatem qui magnam. Reiciendis et asperiores placeat at.","451","2012-04-23 09:58:05","2018-03-20 01:37:09",
"421","303","Sed commodi aut dolores voluptatem saepe consequatur. Et laboriosam dignissimos alias doloribus magni dolores.","452","2012-05-08 16:42:59","2015-10-16 03:53:53",
"422","304","Aperiam iste sed doloribus amet sed sit. Pariatur sint debitis quis harum voluptatem quo. Ut qui debitis sequi repudiandae. Eius voluptatem sit quas vitae. Sint dolores quae id qui sint est.","453","2012-02-10 17:35:33","2012-03-31 05:18:51",
"423","307","Dolore eos eligendi reprehenderit. Iure exercitationem tempora officia eveniet. Id est laboriosam ea consequatur. Non adipisci nisi distinctio hic quisquam.","456","2012-04-25 16:13:52","2013-12-28 17:07:38",
"424","309","Praesentium omnis quis qui occaecati aut autem enim. Itaque ullam voluptatem officiis voluptatum dolorum laudantium et.","458","2014-02-26 21:06:00","2015-09-08 08:52:30",
"425","311","Qui consequatur aut temporibus maiores. Maiores aliquid iure distinctio enim ullam cum. Consequuntur voluptatem natus molestias ipsam eos. Eos et nulla ex excepturi adipisci.","460","2013-01-02 01:20:30","2019-03-03 05:30:03",
"426","314","Saepe eum sunt aspernatur dicta alias sit neque. Nostrum repellat expedita suscipit incidunt.","463","2014-09-27 00:00:50","2017-02-03 19:32:46",
"427","316","Rem quia nostrum ipsa et in corrupti neque. Enim et qui dolor eos tempore rerum saepe. Expedita sit minus asperiores perspiciatis magnam modi.","465","2016-11-13 21:39:54","2017-02-21 23:04:43",
"428","319","In eveniet blanditiis omnis dolor doloremque. Odio cum quis vitae qui. Quisquam ipsa quisquam est excepturi sed qui. Ut illum aperiam ut eum. At suscipit consequatur voluptas quo non ut.","468","2020-02-17 16:34:51","2020-04-11 07:17:09",
"429","320","Cumque quia sed velit est. Esse iusto consequuntur neque maiores tempora. Sunt iure expedita sed sed aliquid. Accusamus est recusandae porro quae commodi sint voluptatem.","469","2016-07-29 21:55:21","2019-02-04 05:03:30",
"430","322","Quo distinctio animi culpa quas blanditiis rerum. Iusto sunt voluptas consequuntur dolor possimus totam ut. Culpa earum voluptas suscipit pariatur optio dolor.","771","2018-06-02 05:55:08","2018-08-28 15:50:26",
"431","324","Suscipit fuga perspiciatis at ipsam doloribus magnam alias. Vel porro deleniti optio omnis. Nostrum beatae voluptate iusto perspiciatis modi ea.","773","2011-10-01 09:33:54","2011-11-26 11:18:42",
"432","326","Quia id quisquam sit ratione ratione sapiente consectetur quo. Dolorem quo voluptatem occaecati dolores quam esse quia. Reiciendis aspernatur ducimus error incidunt.","775","2019-04-28 09:05:03","2020-09-30 13:48:36",
"433","329","Alias vel modi laborum quas unde. Eos rerum culpa illo nostrum enim. Vel molestiae dolorem eum amet possimus minus eos.","778","2014-10-02 21:37:34","2019-12-30 16:09:34",
"434","330","Similique aut cum quam voluptas pariatur non. Enim tempora accusantium consequatur dolorem. Fugiat non dignissimos quibusdam id vitae similique magni.","779","2011-04-11 08:42:20","2016-05-09 11:28:52",
"435","336","Voluptatem incidunt doloremque quaerat qui. Voluptas incidunt neque vel sapiente possimus aut numquam aut. Adipisci fugiat fugiat fugiat eos porro et maiores. Ut quo laborum qui voluptas dolores.","785","2019-08-14 19:38:26","2020-06-26 19:49:42",
"436","337","Cum illum eligendi reiciendis corporis quo repudiandae impedit. Soluta amet saepe vel voluptas neque. Qui commodi qui molestias rerum repellat qui.","786","2016-12-30 00:50:38","2017-06-26 02:18:52",
"437","339","Labore natus nostrum dolore consequuntur. Quas eius earum quod in. Autem cum molestiae consectetur labore animi.
Aut ducimus nemo deleniti architecto vero. Est ab minus quasi dolor.","788","2013-11-03 16:23:56","2018-07-28 18:20:24",
"438","342","Recusandae quisquam ut earum quis. Enim consectetur perferendis id rerum quas vel. Accusantium quia voluptate ab. Unde autem aliquam hic autem in inventore adipisci ut.","791","2014-12-04 22:47:21","2018-02-14 21:08:27",
"439","343","Magni cupiditate eum eaque omnis tempora sit aperiam. Tempora tempora delectus nihil quis autem non. Est modi magni ad vel non est dolor. Magnam reiciendis odit cum beatae.","792","2020-03-20 21:40:51","2020-11-11 04:41:09",
"440","344","Autem veniam blanditiis illum recusandae aut laboriosam nam. Vel nemo laborum ducimus dolores aperiam corrupti. Qui et quae quod quia consequatur. Asperiores culpa aut qui dolor.","793","2012-06-07 15:55:41","2017-09-04 21:44:49",
"441","346","Omnis aperiam laudantium suscipit similique et possimus laborum laborum. Quo ut similique rerum. Quia iusto vitae dolores suscipit quo qui est. Et dolor quasi nam sit quod.","795","2017-10-08 04:23:18","2017-12-26 10:34:38",
"442","348","Aut dolor ad est impedit error illum enim. Aut possimus aspernatur rerum consequatur. Sunt quia quo doloremque perspiciatis possimus quia. Temporibus natus ex repellendus cum.","797","2013-11-29 19:51:49","2018-01-21 21:54:52",
"443","349","Quibusdam qui qui commodi illo deleniti. Qui et accusamus sit voluptatem labore. Amet enim sit earum ut. Non et libero aut repellat.","798","2013-08-23 23:50:58","2017-06-06 03:45:36",
